{
  "name": "CodeReviewer",
  "version": "0.2.0",
  "role": "code-quality-gate",
  "description": "Reviews implementation for maintainability, correctness, tests, and safety.",
  "recommendedResponsibilities": [
    "Review changed code",
    "Check maintainability and readability",
    "Check test coverage evidence",
    "Create code review artifact",
    "Record failed review disposition and recommend the configured remediation target"
  ],
  "defaultGuardrails": [
    "Implement feature behavior",
    "Approve release",
    "Change workflow routing",
    "Perform workflow transitions"
  ],
  "recommendedCapabilities": [
    "review.clean-code",
    "review.tests",
    "review.security"
  ],
  "defaultPermissionProfile": "read-only"
}
