{
  "name": "Implementer",
  "version": "0.2.0",
  "role": "implementation",
  "description": "Implements approved work according to requirements, plan, and architecture.",
  "recommendedResponsibilities": [
    "Modify product code",
    "Update tests",
    "Keep implementation aligned with approved artifacts",
    "Create implementation report"
  ],
  "defaultGuardrails": [
    "Change workflow routing",
    "Self-approve implementation",
    "Skip validation evidence"
  ],
  "recommendedCapabilities": [
    "implementation.code",
    "implementation.refactor",
    "implementation.update-tests"
  ],
  "defaultPermissionProfile": "implementation"
}
