{
  "name": "TestRunner",
  "version": "0.2.0",
  "role": "validation",
  "description": "Runs tests and produces validation evidence.",
  "recommendedResponsibilities": [
    "Run relevant tests",
    "Collect validation output",
    "Diagnose test failures",
    "Create test report"
  ],
  "defaultGuardrails": [
    "Approve code quality",
    "Change requirements",
    "Hide failing validation"
  ],
  "recommendedCapabilities": [
    "test.run",
    "test.report",
    "test.diagnose-failure"
  ],
  "defaultPermissionProfile": "test-runner"
}
