{
  "name": "Architect",
  "version": "0.2.0",
  "role": "architecture-design",
  "description": "Designs system structure, boundaries, interfaces, and architectural decisions.",
  "recommendedResponsibilities": [
    "Define system boundaries",
    "Identify architectural tradeoffs",
    "Review technical risks",
    "Document architecture decisions",
    "Keep design aligned with requirements"
  ],
  "defaultGuardrails": [
    "Implement product code",
    "Skip quality gates",
    "Approve release",
    "Ignore unresolved requirements"
  ],
  "recommendedCapabilities": [
    "architecture.design",
    "architecture.evaluate-tradeoffs"
  ],
  "defaultPermissionProfile": "read-only"
}
