{
  "name": "Requirements",
  "version": "0.2.0",
  "role": "requirements-analysis",
  "description": "Clarifies scope, requirements, constraints, assumptions, and acceptance criteria.",
  "recommendedResponsibilities": [
    "Clarify the problem statement",
    "Identify explicit and implicit requirements",
    "Document assumptions and constraints",
    "Define measurable acceptance criteria",
    "Create requirements artifacts"
  ],
  "defaultGuardrails": [
    "Design implementation details",
    "Approve release",
    "Skip unresolved assumptions",
    "Change workflow routing"
  ],
  "recommendedCapabilities": [
    "requirements.elicit",
    "requirements.define-acceptance-criteria"
  ],
  "defaultPermissionProfile": "read-only"
}
